<?xml version="1.0"?>
<?xml-stylesheet type="text/xsl" href="pdml2html.xsl"?>
<!-- You can find pdml2html.xsl in /Applications/Wireshark.app/Contents/Resources/share/wireshark or at https://code.wireshark.org/review/gitweb?p=wireshark.git;a=blob_plain;f=pdml2html.xsl. -->
<pdml version="0" creator="wireshark/2.2.6" time="Tue May 16 02:53:29 2017" capture_file="/Users/juanjmartinez/Desktop/legac_pfs/backend/code/juan/ProtocolFormatterSystem GUI/30.pcap">
<packet>
  <proto name="geninfo" pos="0" showname="General information" size="60">
    <field name="num" pos="0" show="1" showname="Number" value="1" size="60"/>
    <field name="len" pos="0" show="60" showname="Frame Length" value="3c" size="60"/>
    <field name="caplen" pos="0" show="60" showname="Captured Length" value="3c" size="60"/>
    <field name="timestamp" pos="0" show="Jul  6, 2015 23:29:10.574235000 MDT" showname="Captured Time" value="1436246950.574235000" size="60"/>
  </proto>
  <proto name="frame" showname="Frame 1: 60 bytes on wire (480 bits), 60 bytes captured (480 bits)" size="60" pos="0">
    <field name="frame.encap_type" showname="Encapsulation type: Raw IP (7)" size="0" pos="0" show="7"/>
    <field name="frame.time" showname="Arrival Time: Jul  6, 2015 23:29:10.574235000 MDT" size="0" pos="0" show="Jul  6, 2015 23:29:10.574235000 MDT"/>
    <field name="frame.offset_shift" showname="Time shift for this packet: 0.000000000 seconds" size="0" pos="0" show="0.000000000"/>
    <field name="frame.time_epoch" showname="Epoch Time: 1436246950.574235000 seconds" size="0" pos="0" show="1436246950.574235000"/>
    <field name="frame.time_delta" showname="Time delta from previous captured frame: 0.000000000 seconds" size="0" pos="0" show="0.000000000"/>
    <field name="frame.time_delta_displayed" showname="Time delta from previous displayed frame: 0.000000000 seconds" size="0" pos="0" show="0.000000000"/>
    <field name="frame.time_relative" showname="Time since reference or first frame: 0.000000000 seconds" size="0" pos="0" show="0.000000000"/>
    <field name="frame.number" showname="Frame Number: 1" size="0" pos="0" show="1"/>
    <field name="frame.len" showname="Frame Length: 60 bytes (480 bits)" size="0" pos="0" show="60"/>
    <field name="frame.cap_len" showname="Capture Length: 60 bytes (480 bits)" size="0" pos="0" show="60"/>
    <field name="frame.marked" showname="Frame is marked: False" size="0" pos="0" show="0"/>
    <field name="frame.ignored" showname="Frame is ignored: False" size="0" pos="0" show="0"/>
    <field name="frame.protocols" showname="Protocols in frame: raw:ip:tcp" size="0" pos="0" show="raw:ip:tcp"/>
  </proto>
  <proto name="raw" showname="Raw packet data" size="60" pos="0"/>
  <proto name="ip" showname="Internet Protocol Version 4, Src: 0.0.0.0, Dst: 211.144.94.46" size="20" pos="0">
    <field name="ip.version" showname="0100 .... = Version: 4" size="1" pos="0" show="4" value="4" unmaskedvalue="45"/>
    <field name="ip.hdr_len" showname=".... 0101 = Header Length: 20 bytes (5)" size="1" pos="0" show="20" value="45"/>
    <field name="ip.dsfield" showname="Differentiated Services Field: 0x00 (DSCP: CS0, ECN: Not-ECT)" size="1" pos="1" show="0x00000000" value="00">
      <field name="ip.dsfield.dscp" showname="0000 00.. = Differentiated Services Codepoint: Default (0)" size="1" pos="1" show="0" value="0" unmaskedvalue="00"/>
      <field name="ip.dsfield.ecn" showname=".... ..00 = Explicit Congestion Notification: Not ECN-Capable Transport (0)" size="1" pos="1" show="0" value="0" unmaskedvalue="00"/>
    </field>
    <field name="ip.len" showname="Total Length: 60" size="2" pos="2" show="60" value="003c"/>
    <field name="ip.id" showname="Identification: 0x417e (16766)" size="2" pos="4" show="0x0000417e" value="417e"/>
    <field name="ip.flags" showname="Flags: 0x02 (Don&#x27;t Fragment)" size="1" pos="6" show="0x00000002" value="40">
      <field name="ip.flags.rb" showname="0... .... = Reserved bit: Not set" size="1" pos="6" show="0" value="40"/>
      <field name="ip.flags.df" showname=".1.. .... = Don&#x27;t fragment: Set" size="1" pos="6" show="1" value="40"/>
      <field name="ip.flags.mf" showname="..0. .... = More fragments: Not set" size="1" pos="6" show="0" value="40"/>
    </field>
    <field name="ip.frag_offset" showname="Fragment offset: 0" size="2" pos="6" show="0" value="4000"/>
    <field name="ip.ttl" showname="Time to live: 60" size="1" pos="8" show="60" value="3c"/>
    <field name="ip.proto" showname="Protocol: TCP (6)" size="1" pos="9" show="6" value="06"/>
    <field name="ip.checksum" showname="Header checksum: 0x0000 [validation disabled]" size="2" pos="10" show="0x00000000" value="0000"/>
    <field name="ip.checksum.status" showname="Header checksum status: Unverified" size="0" pos="10" show="2"/>
    <field name="ip.src" showname="Source: 0.0.0.0" size="4" pos="12" show="0.0.0.0" value="00000000"/>
    <field name="ip.addr" showname="Source or Destination Address: 0.0.0.0" hide="yes" size="4" pos="12" show="0.0.0.0" value="00000000"/>
    <field name="ip.src_host" showname="Source Host: 0.0.0.0" hide="yes" size="4" pos="12" show="0.0.0.0" value="00000000"/>
    <field name="ip.host" showname="Source or Destination Host: 0.0.0.0" hide="yes" size="4" pos="12" show="0.0.0.0" value="00000000"/>
    <field name="ip.dst" showname="Destination: 211.144.94.46" size="4" pos="16" show="211.144.94.46" value="d3905e2e"/>
    <field name="ip.addr" showname="Source or Destination Address: 211.144.94.46" hide="yes" size="4" pos="16" show="211.144.94.46" value="d3905e2e"/>
    <field name="ip.dst_host" showname="Destination Host: 211.144.94.46" hide="yes" size="4" pos="16" show="211.144.94.46" value="d3905e2e"/>
    <field name="ip.host" showname="Source or Destination Host: 211.144.94.46" hide="yes" size="4" pos="16" show="211.144.94.46" value="d3905e2e"/>
    <field name="" show="Source GeoIP: Unknown" size="4" pos="12" value="00000000"/>
    <field name="" show="Destination GeoIP: Unknown" size="4" pos="16" value="d3905e2e"/>
  </proto>
  <proto name="tcp" showname="Transmission Control Protocol, Src Port: 61023, Dst Port: 80, Seq: 0, Len: 0" size="40" pos="20">
    <field name="tcp.srcport" showname="Source Port: 61023" size="2" pos="20" show="61023" value="ee5f"/>
    <field name="tcp.dstport" showname="Destination Port: 80" size="2" pos="22" show="80" value="0050"/>
    <field name="tcp.port" showname="Source or Destination Port: 61023" hide="yes" size="2" pos="20" show="61023" value="ee5f"/>
    <field name="tcp.port" showname="Source or Destination Port: 80" hide="yes" size="2" pos="22" show="80" value="0050"/>
    <field name="tcp.stream" showname="Stream index: 0" size="0" pos="20" show="0"/>
    <field name="tcp.len" showname="TCP Segment Len: 0" size="1" pos="32" show="0" value="a0"/>
    <field name="tcp.seq" showname="Sequence number: 0    (relative sequence number)" size="4" pos="24" show="0" value="efa6815e"/>
    <field name="tcp.ack" showname="Acknowledgment number: 0" size="4" pos="28" show="0" value="00000000"/>
    <field name="tcp.hdr_len" showname="Header Length: 40 bytes" size="1" pos="32" show="40" value="a0"/>
    <field name="tcp.flags" showname="Flags: 0x002 (SYN)" size="2" pos="32" show="0x00000002" value="2" unmaskedvalue="a002">
      <field name="tcp.flags.res" showname="000. .... .... = Reserved: Not set" size="1" pos="32" show="0" value="0" unmaskedvalue="a0"/>
      <field name="tcp.flags.ns" showname="...0 .... .... = Nonce: Not set" size="1" pos="32" show="0" value="0" unmaskedvalue="a0"/>
      <field name="tcp.flags.cwr" showname=".... 0... .... = Congestion Window Reduced (CWR): Not set" size="1" pos="33" show="0" value="0" unmaskedvalue="02"/>
      <field name="tcp.flags.ecn" showname=".... .0.. .... = ECN-Echo: Not set" size="1" pos="33" show="0" value="0" unmaskedvalue="02"/>
      <field name="tcp.flags.urg" showname=".... ..0. .... = Urgent: Not set" size="1" pos="33" show="0" value="0" unmaskedvalue="02"/>
      <field name="tcp.flags.ack" showname=".... ...0 .... = Acknowledgment: Not set" size="1" pos="33" show="0" value="0" unmaskedvalue="02"/>
      <field name="tcp.flags.push" showname=".... .... 0... = Push: Not set" size="1" pos="33" show="0" value="0" unmaskedvalue="02"/>
      <field name="tcp.flags.reset" showname=".... .... .0.. = Reset: Not set" size="1" pos="33" show="0" value="0" unmaskedvalue="02"/>
      <field name="tcp.flags.syn" showname=".... .... ..1. = Syn: Set" size="1" pos="33" show="1" value="1" unmaskedvalue="02">
        <field name="_ws.expert" showname="Expert Info (Chat/Sequence): Connection establish request (SYN): server port 80" size="0" pos="33">
          <field name="tcp.connection.syn" showname="Connection establish request (SYN): server port 80" size="0" pos="0" show="" value=""/>
          <field name="_ws.expert.message" showname="Message: Connection establish request (SYN): server port 80" hide="yes" size="0" pos="0" show="Connection establish request (SYN): server port 80"/>
          <field name="_ws.expert.severity" showname="Severity level: Chat" size="0" pos="0" show="2097152"/>
          <field name="_ws.expert.group" showname="Group: Sequence" size="0" pos="0" show="33554432"/>
        </field>
      </field>
      <field name="tcp.flags.fin" showname=".... .... ...0 = Fin: Not set" size="1" pos="33" show="0" value="0" unmaskedvalue="02"/>
      <field name="tcp.flags.str" showname="TCP Flags: \xc2\xb7\xc2\xb7\xc2\xb7\xc2\xb7\xc2\xb7\xc2\xb7\xc2\xb7\xc2\xb7\xc2\xb7\xc2\xb7S\xc2\xb7" size="2" pos="32" show="\xc2\xb7\xc2\xb7\xc2\xb7\xc2\xb7\xc2\xb7\xc2\xb7\xc2\xb7\xc2\xb7\xc2\xb7\xc2\xb7S\xc2\xb7" value="a002"/>
    </field>
    <field name="tcp.window_size_value" showname="Window size value: 5840" size="2" pos="34" show="5840" value="16d0"/>
    <field name="tcp.window_size" showname="Calculated window size: 5840" size="2" pos="34" show="5840" value="16d0"/>
    <field name="tcp.checksum" showname="Checksum: 0x0000 [unverified]" size="2" pos="36" show="0x00000000" value="0000"/>
    <field name="tcp.checksum.status" showname="Checksum Status: Unverified" size="0" pos="36" show="2"/>
    <field name="tcp.urgent_pointer" showname="Urgent pointer: 0" size="2" pos="38" show="0" value="0000"/>
    <field name="tcp.options" showname="Options: (20 bytes), Maximum segment size, SACK permitted, Timestamps, No-Operation (NOP), Window scale" size="20" pos="40" show="02:04:05:b4:04:02:08:0a:20:c0:84:04:00:00:00:00:01:03:03:03" value="020405b40402080a20c084040000000001030303">
      <field name="tcp.options.mss" showname="Maximum segment size: 1460 bytes" size="4" pos="40" show="" value="">
        <field name="tcp.option_kind" showname="Kind: Maximum Segment Size (2)" size="1" pos="40" show="2" value="02"/>
        <field name="tcp.option_len" showname="Length: 4" size="1" pos="41" show="4" value="04"/>
        <field name="tcp.options.mss_val" showname="MSS Value: 1460" size="2" pos="42" show="1460" value="05b4"/>
      </field>
      <field name="tcp.options.sack_perm" showname="TCP SACK Permitted Option: True" size="2" pos="44" show="1" value="0402">
        <field name="tcp.option_kind" showname="Kind: SACK Permitted (4)" size="1" pos="44" show="4" value="04"/>
        <field name="tcp.option_len" showname="Length: 2" size="1" pos="45" show="2" value="02"/>
      </field>
      <field name="" show="Timestamps: TSval 549487620, TSecr 0" size="10" pos="46" value="080a20c0840400000000">
        <field name="tcp.option_kind" showname="Kind: Time Stamp Option (8)" size="1" pos="46" show="8" value="08"/>
        <field name="tcp.option_len" showname="Length: 10" size="1" pos="47" show="10" value="0a"/>
        <field name="tcp.options.timestamp.tsval" showname="Timestamp value: 549487620" size="4" pos="48" show="549487620" value="20c08404"/>
        <field name="tcp.options.timestamp.tsecr" showname="Timestamp echo reply: 0" size="4" pos="52" show="0" value="00000000"/>
      </field>
      <field name="" show="No-Operation (NOP)" size="1" pos="56" value="01">
        <field name="tcp.options.type" showname="Type: 1" size="1" pos="56" show="1" value="01">
          <field name="tcp.options.type.copy" showname="0... .... = Copy on fragmentation: No" size="1" pos="56" show="0" value="0" unmaskedvalue="01"/>
          <field name="tcp.options.type.class" showname=".00. .... = Class: Control (0)" size="1" pos="56" show="0" value="0" unmaskedvalue="01"/>
          <field name="tcp.options.type.number" showname="...0 0001 = Number: No-Operation (NOP) (1)" size="1" pos="56" show="1" value="1" unmaskedvalue="01"/>
        </field>
      </field>
      <field name="" show="Window scale: 3 (multiply by 8)" size="3" pos="57" value="030303">
        <field name="tcp.option_kind" showname="Kind: Window Scale (3)" size="1" pos="57" show="3" value="03"/>
        <field name="tcp.option_len" showname="Length: 3" size="1" pos="58" show="3" value="03"/>
        <field name="tcp.options.wscale.shift" showname="Shift count: 3" size="1" pos="59" show="3" value="03"/>
        <field name="tcp.options.wscale.multiplier" showname="Multiplier: 8" size="1" pos="59" show="8" value="03"/>
      </field>
    </field>
  </proto>
</packet>


<packet>
  <proto name="geninfo" pos="0" showname="General information" size="60">
    <field name="num" pos="0" show="2" showname="Number" value="2" size="60"/>
    <field name="len" pos="0" show="60" showname="Frame Length" value="3c" size="60"/>
    <field name="caplen" pos="0" show="60" showname="Captured Length" value="3c" size="60"/>
    <field name="timestamp" pos="0" show="Jul  6, 2015 23:29:11.059178000 MDT" showname="Captured Time" value="1436246951.059178000" size="60"/>
  </proto>
  <proto name="frame" showname="Frame 2: 60 bytes on wire (480 bits), 60 bytes captured (480 bits)" size="60" pos="0">
    <field name="frame.encap_type" showname="Encapsulation type: Raw IP (7)" size="0" pos="0" show="7"/>
    <field name="frame.time" showname="Arrival Time: Jul  6, 2015 23:29:11.059178000 MDT" size="0" pos="0" show="Jul  6, 2015 23:29:11.059178000 MDT"/>
    <field name="frame.offset_shift" showname="Time shift for this packet: 0.000000000 seconds" size="0" pos="0" show="0.000000000"/>
    <field name="frame.time_epoch" showname="Epoch Time: 1436246951.059178000 seconds" size="0" pos="0" show="1436246951.059178000"/>
    <field name="frame.time_delta" showname="Time delta from previous captured frame: 0.484943000 seconds" size="0" pos="0" show="0.484943000"/>
    <field name="frame.time_delta_displayed" showname="Time delta from previous displayed frame: 0.484943000 seconds" size="0" pos="0" show="0.484943000"/>
    <field name="frame.time_relative" showname="Time since reference or first frame: 0.484943000 seconds" size="0" pos="0" show="0.484943000"/>
    <field name="frame.number" showname="Frame Number: 2" size="0" pos="0" show="2"/>
    <field name="frame.len" showname="Frame Length: 60 bytes (480 bits)" size="0" pos="0" show="60"/>
    <field name="frame.cap_len" showname="Capture Length: 60 bytes (480 bits)" size="0" pos="0" show="60"/>
    <field name="frame.marked" showname="Frame is marked: False" size="0" pos="0" show="0"/>
    <field name="frame.ignored" showname="Frame is ignored: False" size="0" pos="0" show="0"/>
    <field name="frame.protocols" showname="Protocols in frame: raw:ip:tcp" size="0" pos="0" show="raw:ip:tcp"/>
  </proto>
  <proto name="raw" showname="Raw packet data" size="60" pos="0"/>
  <proto name="ip" showname="Internet Protocol Version 4, Src: 211.144.94.46, Dst: 0.0.0.0" size="20" pos="0">
    <field name="ip.version" showname="0100 .... = Version: 4" size="1" pos="0" show="4" value="4" unmaskedvalue="45"/>
    <field name="ip.hdr_len" showname=".... 0101 = Header Length: 20 bytes (5)" size="1" pos="0" show="20" value="45"/>
    <field name="ip.dsfield" showname="Differentiated Services Field: 0x80 (DSCP: CS4, ECN: Not-ECT)" size="1" pos="1" show="0x00000080" value="80">
      <field name="ip.dsfield.dscp" showname="1000 00.. = Differentiated Services Codepoint: Class Selector 4 (32)" size="1" pos="1" show="32" value="20" unmaskedvalue="80"/>
      <field name="ip.dsfield.ecn" showname=".... ..00 = Explicit Congestion Notification: Not ECN-Capable Transport (0)" size="1" pos="1" show="0" value="0" unmaskedvalue="80"/>
    </field>
    <field name="ip.len" showname="Total Length: 60" size="2" pos="2" show="60" value="003c"/>
    <field name="ip.id" showname="Identification: 0x0000 (0)" size="2" pos="4" show="0x00000000" value="0000"/>
    <field name="ip.flags" showname="Flags: 0x02 (Don&#x27;t Fragment)" size="1" pos="6" show="0x00000002" value="40">
      <field name="ip.flags.rb" showname="0... .... = Reserved bit: Not set" size="1" pos="6" show="0" value="40"/>
      <field name="ip.flags.df" showname=".1.. .... = Don&#x27;t fragment: Set" size="1" pos="6" show="1" value="40"/>
      <field name="ip.flags.mf" showname="..0. .... = More fragments: Not set" size="1" pos="6" show="0" value="40"/>
    </field>
    <field name="ip.frag_offset" showname="Fragment offset: 0" size="2" pos="6" show="0" value="4000"/>
    <field name="ip.ttl" showname="Time to live: 38" size="1" pos="8" show="38" value="26"/>
    <field name="ip.proto" showname="Protocol: TCP (6)" size="1" pos="9" show="6" value="06"/>
    <field name="ip.checksum" showname="Header checksum: 0x0000 [validation disabled]" size="2" pos="10" show="0x00000000" value="0000"/>
    <field name="ip.checksum.status" showname="Header checksum status: Unverified" size="0" pos="10" show="2"/>
    <field name="ip.src" showname="Source: 211.144.94.46" size="4" pos="12" show="211.144.94.46" value="d3905e2e"/>
    <field name="ip.addr" showname="Source or Destination Address: 211.144.94.46" hide="yes" size="4" pos="12" show="211.144.94.46" value="d3905e2e"/>
    <field name="ip.src_host" showname="Source Host: 211.144.94.46" hide="yes" size="4" pos="12" show="211.144.94.46" value="d3905e2e"/>
    <field name="ip.host" showname="Source or Destination Host: 211.144.94.46" hide="yes" size="4" pos="12" show="211.144.94.46" value="d3905e2e"/>
    <field name="ip.dst" showname="Destination: 0.0.0.0" size="4" pos="16" show="0.0.0.0" value="00000000"/>
    <field name="ip.addr" showname="Source or Destination Address: 0.0.0.0" hide="yes" size="4" pos="16" show="0.0.0.0" value="00000000"/>
    <field name="ip.dst_host" showname="Destination Host: 0.0.0.0" hide="yes" size="4" pos="16" show="0.0.0.0" value="00000000"/>
    <field name="ip.host" showname="Source or Destination Host: 0.0.0.0" hide="yes" size="4" pos="16" show="0.0.0.0" value="00000000"/>
    <field name="" show="Source GeoIP: Unknown" size="4" pos="12" value="d3905e2e"/>
    <field name="" show="Destination GeoIP: Unknown" size="4" pos="16" value="00000000"/>
  </proto>
  <proto name="tcp" showname="Transmission Control Protocol, Src Port: 80, Dst Port: 61023, Seq: 0, Ack: 1, Len: 0" size="40" pos="20">
    <field name="tcp.srcport" showname="Source Port: 80" size="2" pos="20" show="80" value="0050"/>
    <field name="tcp.dstport" showname="Destination Port: 61023" size="2" pos="22" show="61023" value="ee5f"/>
    <field name="tcp.port" showname="Source or Destination Port: 80" hide="yes" size="2" pos="20" show="80" value="0050"/>
    <field name="tcp.port" showname="Source or Destination Port: 61023" hide="yes" size="2" pos="22" show="61023" value="ee5f"/>
    <field name="tcp.stream" showname="Stream index: 0" size="0" pos="20" show="0"/>
    <field name="tcp.len" showname="TCP Segment Len: 0" size="1" pos="32" show="0" value="a0"/>
    <field name="tcp.seq" showname="Sequence number: 0    (relative sequence number)" size="4" pos="24" show="0" value="c7ebfe82"/>
    <field name="tcp.ack" showname="Acknowledgment number: 1    (relative ack number)" size="4" pos="28" show="1" value="efa6815f"/>
    <field name="tcp.hdr_len" showname="Header Length: 40 bytes" size="1" pos="32" show="40" value="a0"/>
    <field name="tcp.flags" showname="Flags: 0x012 (SYN, ACK)" size="2" pos="32" show="0x00000012" value="12" unmaskedvalue="a012">
      <field name="tcp.flags.res" showname="000. .... .... = Reserved: Not set" size="1" pos="32" show="0" value="0" unmaskedvalue="a0"/>
      <field name="tcp.flags.ns" showname="...0 .... .... = Nonce: Not set" size="1" pos="32" show="0" value="0" unmaskedvalue="a0"/>
      <field name="tcp.flags.cwr" showname=".... 0... .... = Congestion Window Reduced (CWR): Not set" size="1" pos="33" show="0" value="0" unmaskedvalue="12"/>
      <field name="tcp.flags.ecn" showname=".... .0.. .... = ECN-Echo: Not set" size="1" pos="33" show="0" value="0" unmaskedvalue="12"/>
      <field name="tcp.flags.urg" showname=".... ..0. .... = Urgent: Not set" size="1" pos="33" show="0" value="0" unmaskedvalue="12"/>
      <field name="tcp.flags.ack" showname=".... ...1 .... = Acknowledgment: Set" size="1" pos="33" show="1" value="1" unmaskedvalue="12"/>
      <field name="tcp.flags.push" showname=".... .... 0... = Push: Not set" size="1" pos="33" show="0" value="0" unmaskedvalue="12"/>
      <field name="tcp.flags.reset" showname=".... .... .0.. = Reset: Not set" size="1" pos="33" show="0" value="0" unmaskedvalue="12"/>
      <field name="tcp.flags.syn" showname=".... .... ..1. = Syn: Set" size="1" pos="33" show="1" value="1" unmaskedvalue="12">
        <field name="_ws.expert" showname="Expert Info (Chat/Sequence): Connection establish acknowledge (SYN+ACK): server port 80" size="0" pos="33">
          <field name="tcp.connection.sack" showname="Connection establish acknowledge (SYN+ACK): server port 80" size="0" pos="0" show="" value=""/>
          <field name="_ws.expert.message" showname="Message: Connection establish acknowledge (SYN+ACK): server port 80" hide="yes" size="0" pos="0" show="Connection establish acknowledge (SYN+ACK): server port 80"/>
          <field name="_ws.expert.severity" showname="Severity level: Chat" size="0" pos="0" show="2097152"/>
          <field name="_ws.expert.group" showname="Group: Sequence" size="0" pos="0" show="33554432"/>
        </field>
      </field>
      <field name="tcp.flags.fin" showname=".... .... ...0 = Fin: Not set" size="1" pos="33" show="0" value="0" unmaskedvalue="12"/>
      <field name="tcp.flags.str" showname="TCP Flags: \xc2\xb7\xc2\xb7\xc2\xb7\xc2\xb7\xc2\xb7\xc2\xb7\xc2\xb7A\xc2\xb7\xc2\xb7S\xc2\xb7" size="2" pos="32" show="\xc2\xb7\xc2\xb7\xc2\xb7\xc2\xb7\xc2\xb7\xc2\xb7\xc2\xb7A\xc2\xb7\xc2\xb7S\xc2\xb7" value="a012"/>
    </field>
    <field name="tcp.window_size_value" showname="Window size value: 14480" size="2" pos="34" show="14480" value="3890"/>
    <field name="tcp.window_size" showname="Calculated window size: 14480" size="2" pos="34" show="14480" value="3890"/>
    <field name="tcp.checksum" showname="Checksum: 0x0000 [unverified]" size="2" pos="36" show="0x00000000" value="0000"/>
    <field name="tcp.checksum.status" showname="Checksum Status: Unverified" size="0" pos="36" show="2"/>
    <field name="tcp.urgent_pointer" showname="Urgent pointer: 0" size="2" pos="38" show="0" value="0000"/>
    <field name="tcp.options" showname="Options: (20 bytes), Maximum segment size, SACK permitted, Timestamps, No-Operation (NOP), Window scale" size="20" pos="40" show="02:04:05:b4:04:02:08:0a:eb:6e:ad:93:20:c0:84:04:01:03:03:09" value="020405b40402080aeb6ead9320c0840401030309">
      <field name="tcp.options.mss" showname="Maximum segment size: 1460 bytes" size="4" pos="40" show="" value="">
        <field name="tcp.option_kind" showname="Kind: Maximum Segment Size (2)" size="1" pos="40" show="2" value="02"/>
        <field name="tcp.option_len" showname="Length: 4" size="1" pos="41" show="4" value="04"/>
        <field name="tcp.options.mss_val" showname="MSS Value: 1460" size="2" pos="42" show="1460" value="05b4"/>
      </field>
      <field name="tcp.options.sack_perm" showname="TCP SACK Permitted Option: True" size="2" pos="44" show="1" value="0402">
        <field name="tcp.option_kind" showname="Kind: SACK Permitted (4)" size="1" pos="44" show="4" value="04"/>
        <field name="tcp.option_len" showname="Length: 2" size="1" pos="45" show="2" value="02"/>
      </field>
      <field name="" show="Timestamps: TSval 3949899155, TSecr 549487620" size="10" pos="46" value="080aeb6ead9320c08404">
        <field name="tcp.option_kind" showname="Kind: Time Stamp Option (8)" size="1" pos="46" show="8" value="08"/>
        <field name="tcp.option_len" showname="Length: 10" size="1" pos="47" show="10" value="0a"/>
        <field name="tcp.options.timestamp.tsval" showname="Timestamp value: 3949899155" size="4" pos="48" show="3949899155" value="eb6ead93"/>
        <field name="tcp.options.timestamp.tsecr" showname="Timestamp echo reply: 549487620" size="4" pos="52" show="549487620" value="20c08404"/>
      </field>
      <field name="" show="No-Operation (NOP)" size="1" pos="56" value="01">
        <field name="tcp.options.type" showname="Type: 1" size="1" pos="56" show="1" value="01">
          <field name="tcp.options.type.copy" showname="0... .... = Copy on fragmentation: No" size="1" pos="56" show="0" value="0" unmaskedvalue="01"/>
          <field name="tcp.options.type.class" showname=".00. .... = Class: Control (0)" size="1" pos="56" show="0" value="0" unmaskedvalue="01"/>
          <field name="tcp.options.type.number" showname="...0 0001 = Number: No-Operation (NOP) (1)" size="1" pos="56" show="1" value="1" unmaskedvalue="01"/>
        </field>
      </field>
      <field name="" show="Window scale: 9 (multiply by 512)" size="3" pos="57" value="030309">
        <field name="tcp.option_kind" showname="Kind: Window Scale (3)" size="1" pos="57" show="3" value="03"/>
        <field name="tcp.option_len" showname="Length: 3" size="1" pos="58" show="3" value="03"/>
        <field name="tcp.options.wscale.shift" showname="Shift count: 9" size="1" pos="59" show="9" value="09"/>
        <field name="tcp.options.wscale.multiplier" showname="Multiplier: 512" size="1" pos="59" show="512" value="09"/>
      </field>
    </field>
    <field name="tcp.analysis" showname="SEQ/ACK analysis" size="0" pos="20" show="" value="">
      <field name="tcp.analysis.acks_frame" showname="This is an ACK to the segment in frame: 1" size="0" pos="20" show="1"/>
      <field name="tcp.analysis.ack_rtt" showname="The RTT to ACK the segment was: 0.484943000 seconds" size="0" pos="20" show="0.484943000"/>
    </field>
  </proto>
</packet>


<packet>
  <proto name="geninfo" pos="0" showname="General information" size="52">
    <field name="num" pos="0" show="3" showname="Number" value="3" size="52"/>
    <field name="len" pos="0" show="52" showname="Frame Length" value="34" size="52"/>
    <field name="caplen" pos="0" show="52" showname="Captured Length" value="34" size="52"/>
    <field name="timestamp" pos="0" show="Jul  6, 2015 23:29:11.060625000 MDT" showname="Captured Time" value="1436246951.060625000" size="52"/>
  </proto>
  <proto name="frame" showname="Frame 3: 52 bytes on wire (416 bits), 52 bytes captured (416 bits)" size="52" pos="0">
    <field name="frame.encap_type" showname="Encapsulation type: Raw IP (7)" size="0" pos="0" show="7"/>
    <field name="frame.time" showname="Arrival Time: Jul  6, 2015 23:29:11.060625000 MDT" size="0" pos="0" show="Jul  6, 2015 23:29:11.060625000 MDT"/>
    <field name="frame.offset_shift" showname="Time shift for this packet: 0.000000000 seconds" size="0" pos="0" show="0.000000000"/>
    <field name="frame.time_epoch" showname="Epoch Time: 1436246951.060625000 seconds" size="0" pos="0" show="1436246951.060625000"/>
    <field name="frame.time_delta" showname="Time delta from previous captured frame: 0.001447000 seconds" size="0" pos="0" show="0.001447000"/>
    <field name="frame.time_delta_displayed" showname="Time delta from previous displayed frame: 0.001447000 seconds" size="0" pos="0" show="0.001447000"/>
    <field name="frame.time_relative" showname="Time since reference or first frame: 0.486390000 seconds" size="0" pos="0" show="0.486390000"/>
    <field name="frame.number" showname="Frame Number: 3" size="0" pos="0" show="3"/>
    <field name="frame.len" showname="Frame Length: 52 bytes (416 bits)" size="0" pos="0" show="52"/>
    <field name="frame.cap_len" showname="Capture Length: 52 bytes (416 bits)" size="0" pos="0" show="52"/>
    <field name="frame.marked" showname="Frame is marked: False" size="0" pos="0" show="0"/>
    <field name="frame.ignored" showname="Frame is ignored: False" size="0" pos="0" show="0"/>
    <field name="frame.protocols" showname="Protocols in frame: raw:ip:tcp" size="0" pos="0" show="raw:ip:tcp"/>
  </proto>
  <proto name="raw" showname="Raw packet data" size="52" pos="0"/>
  <proto name="ip" showname="Internet Protocol Version 4, Src: 0.0.0.0, Dst: 211.144.94.46" size="20" pos="0">
    <field name="ip.version" showname="0100 .... = Version: 4" size="1" pos="0" show="4" value="4" unmaskedvalue="45"/>
    <field name="ip.hdr_len" showname=".... 0101 = Header Length: 20 bytes (5)" size="1" pos="0" show="20" value="45"/>
    <field name="ip.dsfield" showname="Differentiated Services Field: 0x00 (DSCP: CS0, ECN: Not-ECT)" size="1" pos="1" show="0x00000000" value="00">
      <field name="ip.dsfield.dscp" showname="0000 00.. = Differentiated Services Codepoint: Default (0)" size="1" pos="1" show="0" value="0" unmaskedvalue="00"/>
      <field name="ip.dsfield.ecn" showname=".... ..00 = Explicit Congestion Notification: Not ECN-Capable Transport (0)" size="1" pos="1" show="0" value="0" unmaskedvalue="00"/>
    </field>
    <field name="ip.len" showname="Total Length: 52" size="2" pos="2" show="52" value="0034"/>
    <field name="ip.id" showname="Identification: 0x417f (16767)" size="2" pos="4" show="0x0000417f" value="417f"/>
    <field name="ip.flags" showname="Flags: 0x02 (Don&#x27;t Fragment)" size="1" pos="6" show="0x00000002" value="40">
      <field name="ip.flags.rb" showname="0... .... = Reserved bit: Not set" size="1" pos="6" show="0" value="40"/>
      <field name="ip.flags.df" showname=".1.. .... = Don&#x27;t fragment: Set" size="1" pos="6" show="1" value="40"/>
      <field name="ip.flags.mf" showname="..0. .... = More fragments: Not set" size="1" pos="6" show="0" value="40"/>
    </field>
    <field name="ip.frag_offset" showname="Fragment offset: 0" size="2" pos="6" show="0" value="4000"/>
    <field name="ip.ttl" showname="Time to live: 60" size="1" pos="8" show="60" value="3c"/>
    <field name="ip.proto" showname="Protocol: TCP (6)" size="1" pos="9" show="6" value="06"/>
    <field name="ip.checksum" showname="Header checksum: 0x0000 [validation disabled]" size="2" pos="10" show="0x00000000" value="0000"/>
    <field name="ip.checksum.status" showname="Header checksum status: Unverified" size="0" pos="10" show="2"/>
    <field name="ip.src" showname="Source: 0.0.0.0" size="4" pos="12" show="0.0.0.0" value="00000000"/>
    <field name="ip.addr" showname="Source or Destination Address: 0.0.0.0" hide="yes" size="4" pos="12" show="0.0.0.0" value="00000000"/>
    <field name="ip.src_host" showname="Source Host: 0.0.0.0" hide="yes" size="4" pos="12" show="0.0.0.0" value="00000000"/>
    <field name="ip.host" showname="Source or Destination Host: 0.0.0.0" hide="yes" size="4" pos="12" show="0.0.0.0" value="00000000"/>
    <field name="ip.dst" showname="Destination: 211.144.94.46" size="4" pos="16" show="211.144.94.46" value="d3905e2e"/>
    <field name="ip.addr" showname="Source or Destination Address: 211.144.94.46" hide="yes" size="4" pos="16" show="211.144.94.46" value="d3905e2e"/>
    <field name="ip.dst_host" showname="Destination Host: 211.144.94.46" hide="yes" size="4" pos="16" show="211.144.94.46" value="d3905e2e"/>
    <field name="ip.host" showname="Source or Destination Host: 211.144.94.46" hide="yes" size="4" pos="16" show="211.144.94.46" value="d3905e2e"/>
    <field name="" show="Source GeoIP: Unknown" size="4" pos="12" value="00000000"/>
    <field name="" show="Destination GeoIP: Unknown" size="4" pos="16" value="d3905e2e"/>
  </proto>
  <proto name="tcp" showname="Transmission Control Protocol, Src Port: 61023, Dst Port: 80, Seq: 1, Ack: 1, Len: 0" size="32" pos="20">
    <field name="tcp.srcport" showname="Source Port: 61023" size="2" pos="20" show="61023" value="ee5f"/>
    <field name="tcp.dstport" showname="Destination Port: 80" size="2" pos="22" show="80" value="0050"/>
    <field name="tcp.port" showname="Source or Destination Port: 61023" hide="yes" size="2" pos="20" show="61023" value="ee5f"/>
    <field name="tcp.port" showname="Source or Destination Port: 80" hide="yes" size="2" pos="22" show="80" value="0050"/>
    <field name="tcp.stream" showname="Stream index: 0" size="0" pos="20" show="0"/>
    <field name="tcp.len" showname="TCP Segment Len: 0" size="1" pos="32" show="0" value="80"/>
    <field name="tcp.seq" showname="Sequence number: 1    (relative sequence number)" size="4" pos="24" show="1" value="efa6815f"/>
    <field name="tcp.ack" showname="Acknowledgment number: 1    (relative ack number)" size="4" pos="28" show="1" value="c7ebfe83"/>
    <field name="tcp.hdr_len" showname="Header Length: 32 bytes" size="1" pos="32" show="32" value="80"/>
    <field name="tcp.flags" showname="Flags: 0x010 (ACK)" size="2" pos="32" show="0x00000010" value="10" unmaskedvalue="8010">
      <field name="tcp.flags.res" showname="000. .... .... = Reserved: Not set" size="1" pos="32" show="0" value="0" unmaskedvalue="80"/>
      <field name="tcp.flags.ns" showname="...0 .... .... = Nonce: Not set" size="1" pos="32" show="0" value="0" unmaskedvalue="80"/>
      <field name="tcp.flags.cwr" showname=".... 0... .... = Congestion Window Reduced (CWR): Not set" size="1" pos="33" show="0" value="0" unmaskedvalue="10"/>
      <field name="tcp.flags.ecn" showname=".... .0.. .... = ECN-Echo: Not set" size="1" pos="33" show="0" value="0" unmaskedvalue="10"/>
      <field name="tcp.flags.urg" showname=".... ..0. .... = Urgent: Not set" size="1" pos="33" show="0" value="0" unmaskedvalue="10"/>
      <field name="tcp.flags.ack" showname=".... ...1 .... = Acknowledgment: Set" size="1" pos="33" show="1" value="1" unmaskedvalue="10"/>
      <field name="tcp.flags.push" showname=".... .... 0... = Push: Not set" size="1" pos="33" show="0" value="0" unmaskedvalue="10"/>
      <field name="tcp.flags.reset" showname=".... .... .0.. = Reset: Not set" size="1" pos="33" show="0" value="0" unmaskedvalue="10"/>
      <field name="tcp.flags.syn" showname=".... .... ..0. = Syn: Not set" size="1" pos="33" show="0" value="0" unmaskedvalue="10"/>
      <field name="tcp.flags.fin" showname=".... .... ...0 = Fin: Not set" size="1" pos="33" show="0" value="0" unmaskedvalue="10"/>
      <field name="tcp.flags.str" showname="TCP Flags: \xc2\xb7\xc2\xb7\xc2\xb7\xc2\xb7\xc2\xb7\xc2\xb7\xc2\xb7A\xc2\xb7\xc2\xb7\xc2\xb7\xc2\xb7" size="2" pos="32" show="\xc2\xb7\xc2\xb7\xc2\xb7\xc2\xb7\xc2\xb7\xc2\xb7\xc2\xb7A\xc2\xb7\xc2\xb7\xc2\xb7\xc2\xb7" value="8010"/>
    </field>
    <field name="tcp.window_size_value" showname="Window size value: 730" size="2" pos="34" show="730" value="02da"/>
    <field name="tcp.window_size" showname="Calculated window size: 5840" size="2" pos="34" show="5840" value="02da"/>
    <field name="tcp.window_size_scalefactor" showname="Window size scaling factor: 8" size="2" pos="34" show="8" value="02da"/>
    <field name="tcp.checksum" showname="Checksum: 0x0000 [unverified]" size="2" pos="36" show="0x00000000" value="0000"/>
    <field name="tcp.checksum.status" showname="Checksum Status: Unverified" size="0" pos="36" show="2"/>
    <field name="tcp.urgent_pointer" showname="Urgent pointer: 0" size="2" pos="38" show="0" value="0000"/>
    <field name="tcp.options" showname="Options: (12 bytes), No-Operation (NOP), No-Operation (NOP), Timestamps" size="12" pos="40" show="01:01:08:0a:20:c0:84:34:eb:6e:ad:93" value="0101080a20c08434eb6ead93">
      <field name="" show="No-Operation (NOP)" size="1" pos="40" value="01">
        <field name="tcp.options.type" showname="Type: 1" size="1" pos="40" show="1" value="01">
          <field name="tcp.options.type.copy" showname="0... .... = Copy on fragmentation: No" size="1" pos="40" show="0" value="0" unmaskedvalue="01"/>
          <field name="tcp.options.type.class" showname=".00. .... = Class: Control (0)" size="1" pos="40" show="0" value="0" unmaskedvalue="01"/>
          <field name="tcp.options.type.number" showname="...0 0001 = Number: No-Operation (NOP) (1)" size="1" pos="40" show="1" value="1" unmaskedvalue="01"/>
        </field>
      </field>
      <field name="" show="No-Operation (NOP)" size="1" pos="41" value="01">
        <field name="tcp.options.type" showname="Type: 1" size="1" pos="41" show="1" value="01">
          <field name="tcp.options.type.copy" showname="0... .... = Copy on fragmentation: No" size="1" pos="41" show="0" value="0" unmaskedvalue="01"/>
          <field name="tcp.options.type.class" showname=".00. .... = Class: Control (0)" size="1" pos="41" show="0" value="0" unmaskedvalue="01"/>
          <field name="tcp.options.type.number" showname="...0 0001 = Number: No-Operation (NOP) (1)" size="1" pos="41" show="1" value="1" unmaskedvalue="01"/>
        </field>
      </field>
      <field name="" show="Timestamps: TSval 549487668, TSecr 3949899155" size="10" pos="42" value="080a20c08434eb6ead93">
        <field name="tcp.option_kind" showname="Kind: Time Stamp Option (8)" size="1" pos="42" show="8" value="08"/>
        <field name="tcp.option_len" showname="Length: 10" size="1" pos="43" show="10" value="0a"/>
        <field name="tcp.options.timestamp.tsval" showname="Timestamp value: 549487668" size="4" pos="44" show="549487668" value="20c08434"/>
        <field name="tcp.options.timestamp.tsecr" showname="Timestamp echo reply: 3949899155" size="4" pos="48" show="3949899155" value="eb6ead93"/>
      </field>
    </field>
    <field name="tcp.analysis" showname="SEQ/ACK analysis" size="0" pos="20" show="" value="">
      <field name="tcp.analysis.acks_frame" showname="This is an ACK to the segment in frame: 2" size="0" pos="20" show="2"/>
      <field name="tcp.analysis.ack_rtt" showname="The RTT to ACK the segment was: 0.001447000 seconds" size="0" pos="20" show="0.001447000"/>
      <field name="tcp.analysis.initial_rtt" showname="iRTT: 0.486390000 seconds" size="0" pos="20" show="0.486390000"/>
    </field>
  </proto>
</packet>


<packet>
  <proto name="geninfo" pos="0" showname="General information" size="427">
    <field name="num" pos="0" show="4" showname="Number" value="4" size="427"/>
    <field name="len" pos="0" show="427" showname="Frame Length" value="1ab" size="427"/>
    <field name="caplen" pos="0" show="427" showname="Captured Length" value="1ab" size="427"/>
    <field name="timestamp" pos="0" show="Jul  6, 2015 23:29:11.061060000 MDT" showname="Captured Time" value="1436246951.061060000" size="427"/>
  </proto>
  <proto name="frame" showname="Frame 4: 427 bytes on wire (3416 bits), 427 bytes captured (3416 bits)" size="427" pos="0">
    <field name="frame.encap_type" showname="Encapsulation type: Raw IP (7)" size="0" pos="0" show="7"/>
    <field name="frame.time" showname="Arrival Time: Jul  6, 2015 23:29:11.061060000 MDT" size="0" pos="0" show="Jul  6, 2015 23:29:11.061060000 MDT"/>
    <field name="frame.offset_shift" showname="Time shift for this packet: 0.000000000 seconds" size="0" pos="0" show="0.000000000"/>
    <field name="frame.time_epoch" showname="Epoch Time: 1436246951.061060000 seconds" size="0" pos="0" show="1436246951.061060000"/>
    <field name="frame.time_delta" showname="Time delta from previous captured frame: 0.000435000 seconds" size="0" pos="0" show="0.000435000"/>
    <field name="frame.time_delta_displayed" showname="Time delta from previous displayed frame: 0.000435000 seconds" size="0" pos="0" show="0.000435000"/>
